{
  "$schema": "https://json-schema.org/draft/2020-12/schema",
  "title": "听鉴 Agent 评测任务清单",
  "type": "object",
  "required": ["schema_version", "task", "samples"],
  "additionalProperties": false,
  "properties": {
    "schema_version": {
      "const": 1
    },
    "task": {
      "type": "object",
      "required": ["title", "kind", "mode"],
      "additionalProperties": false,
      "properties": {
        "title": {
          "type": "string",
          "minLength": 1,
          "maxLength": 150
        },
        "kind": {
          "enum": ["算法版本", "VPU 支路", "级联链路", "竞品算法", "竞品整机"]
        },
        "mode": {
          "enum": ["development", "blind"]
        },
        "evaluation": {
          "enum": ["preference", "mos"]
        },
        "dimensions": {
          "type": "array",
          "minItems": 1,
          "maxItems": 8,
          "items": {
            "type": "object",
            "required": ["key", "name", "anchors"],
            "additionalProperties": false,
            "properties": {
              "key": {
                "type": "string",
                "pattern": "^[a-zA-Z][a-zA-Z0-9_]{0,63}$"
              },
              "name": {
                "type": "string",
                "minLength": 1,
                "maxLength": 40
              },
              "question": {
                "type": "string",
                "maxLength": 200
              },
              "anchors": {
                "type": "array",
                "minItems": 5,
                "maxItems": 5,
                "items": {
                  "type": "string",
                  "minLength": 1,
                  "maxLength": 80
                }
              }
            }
          }
        }
      }
    },
    "participants": {
      "type": "array",
      "items": {
        "type": "object",
        "required": ["name"],
        "additionalProperties": false,
        "properties": {
          "name": {
            "type": "string",
            "minLength": 1,
            "maxLength": 60
          }
        }
      }
    },
    "samples": {
      "type": "array",
      "minItems": 1,
      "items": {
        "type": "object",
        "required": ["key", "name", "provenance", "candidates"],
        "additionalProperties": false,
        "properties": {
          "key": {
            "type": "string",
            "pattern": "^[a-zA-Z0-9][a-zA-Z0-9._-]{0,63}$"
          },
          "name": {
            "type": "string",
            "minLength": 1,
            "maxLength": 100
          },
          "scene": {
            "type": "string",
            "maxLength": 200
          },
          "provenance": {
            "enum": [
              "PUBLIC reproducible",
              "DECLASSIFIED real-device",
              "PRIVATE local verification"
            ]
          },
          "segment": {
            "type": "object",
            "required": ["start_seconds", "end_seconds"],
            "additionalProperties": false,
            "properties": {
              "start_seconds": {
                "type": "number",
                "minimum": 0
              },
              "end_seconds": {
                "type": "number",
                "exclusiveMinimum": 0
              }
            }
          },
          "candidates": {
            "type": "array",
            "minItems": 2,
            "maxItems": 6,
            "items": {
              "type": "object",
              "required": ["key", "name", "version", "source", "channel"],
              "additionalProperties": false,
              "properties": {
                "key": {
                  "type": "string",
                  "pattern": "^[a-zA-Z0-9][a-zA-Z0-9._-]{0,63}$"
                },
                "name": {
                  "type": "string",
                  "minLength": 1,
                  "maxLength": 120
                },
                "version": {
                  "type": "string",
                  "minLength": 1,
                  "maxLength": 200
                },
                "source": {
                  "type": "string",
                  "minLength": 1
                },
                "channel": {
                  "type": "integer",
                  "minimum": 0
                },
                "reference": {
                  "type": "boolean",
                  "default": false
                },
                "timbre_reference": {
                  "type": "boolean",
                  "default": false
                },
                "apply_alignment": {
                  "type": "boolean",
                  "default": false
                },
                "apply_loudness": {
                  "type": "boolean",
                  "default": false
                }
              }
            }
          }
        }
      }
    },
    "publish": {
      "type": "boolean",
      "default": false
    },
    "conversion": {
      "type": "object",
      "additionalProperties": false,
      "properties": {
        "resample_to_16000": {
          "type": "boolean",
          "default": false,
          "description": "显式许可把非 16 kHz 源重采样到 16 kHz；不许可时遇到非 16 kHz 源必须拒绝"
        },
        "note": {
          "type": "string",
          "maxLength": 500
        }
      }
    }
  }
}
